,explicit_sentence,obscure_sentence,explicit_entity,obscure_entity,fact1,fact2,answer
711,The country of citizenship of Sophia of Nassau is,The country of citizenship of the mother of Gustaf V of Sweden is,Sophia of Nassau,the mother of Gustaf V of Sweden,"['Gustaf V of Sweden', 'mother', 'Sophia of Nassau']","['Sophia of Nassau', 'country of citizenship', 'Norway']",Norway
712,The place of birth of Reinhold Schünzel is,The place of birth of the director of Adam and Eve is,Reinhold Schünzel,the director of Adam and Eve,"['Adam and Eve', 'director', 'Reinhold Schünzel']","['Reinhold Schünzel', 'place of birth', 'Hamburg']",Hamburg
713,The date of death of Maud Chaworth is,The date of death of the mother of Eleanor of Lancaster is,Maud Chaworth,the mother of Eleanor of Lancaster,"['Eleanor of Lancaster', 'mother', 'Maud Chaworth']","['Maud Chaworth', 'date of death', '1322']",1322
714,The place of birth of Cheryl Dunye is,The place of birth of the director of The Watermelon Woman is,Cheryl Dunye,the director of The Watermelon Woman,"['The Watermelon Woman', 'director', 'Cheryl Dunye']","['Cheryl Dunye', 'place of birth', 'Liberian']",Liberian
715,The country of citizenship of Connie Chan is,The country of citizenship of the mother of Dexter Young is,Connie Chan,the mother of Dexter Young,"['Dexter Young', 'mother', 'Connie Chan']","['Connie Chan', 'country of citizenship', 'China']",China
716,The place of birth of Mick Garris is,The place of birth of the director of Nightmare Cinema is,Mick Garris,the director of Nightmare Cinema,"['Nightmare Cinema', 'director', 'Mick Garris']","['Mick Garris', 'place of birth', 'Santa Monica']",Santa Monica
717,The employer of Leo Laporte is,The employer of the creator of Call for Help is,Leo Laporte,the creator of Call for Help,"['Call for Help', 'creator', 'Leo Laporte']","['Leo Laporte', 'employer', 'TWiT.tv']",TWiT.tv
718,The place of death of Elbridge Gerry is,The place of death of the spouse of Ann Thompson Gerry is,Elbridge Gerry,the spouse of Ann Thompson Gerry,"['Ann Thompson Gerry', 'spouse', 'Elbridge Gerry']","['Elbridge Gerry', 'place of death', 'Washington, DC']","Washington, DC"
719,The place of birth of Niels Arden Oplev is,The place of birth of the director of The Girl with the Dragon Tattoo is,Niels Arden Oplev,the director of The Girl with the Dragon Tattoo,"['The Girl with the Dragon Tattoo', 'director', 'Niels Arden Oplev']","['Niels Arden Oplev', 'place of birth', 'Denmark']",Denmark
720,The place of burial of Antiochus I Theos of Commagene is,The place of burial of the father of Athenais of Media Atropatene is,Antiochus I Theos of Commagene,the father of Athenais of Media Atropatene,"['Athenais of Media Atropatene', 'father', 'Antiochus I Theos of Commagene']","['Antiochus I Theos of Commagene', 'place of burial', 'Mount Nemrut']",Mount Nemrut
721,The country of citizenship of Clifton Ko is,"The country of citizenship of the director of All's Well, Ends Well Too is",Clifton Ko,"the director of All's Well, Ends Well Too","[""All's Well, Ends Well Too"", 'director', 'Clifton Ko']","['Clifton Ko', 'country of citizenship', 'Chinese']",Chinese
722,Denis Sanders was educated at,The director of Shock Treatment was educated at,Denis Sanders,the director of Shock Treatment,"['Shock Treatment', 'director', 'Denis Sanders']","['Denis Sanders', 'educated at', 'UCLA']",UCLA
723,The place of burial of Khufu is,The place of burial of the father of Nefertiabet is,Khufu,the father of Nefertiabet,"['Nefertiabet', 'father', 'Khufu']","['Khufu', 'place of burial', 'Great Pyramid of Giza']",Great Pyramid of Giza
724,The place of death of Bernard Borderie is,The place of death of the director of Hardi Pardaillan! is,Bernard Borderie,the director of Hardi Pardaillan!,"['Hardi Pardaillan!', 'director', 'Bernard Borderie']","['Bernard Borderie', 'place of death', 'Paris']",Paris
725,The place of burial of Alekos Sakellarios is,The place of burial of the director of Despinis eton 39 is,Alekos Sakellarios,the director of Despinis eton 39,"['Despinis eton 39', 'director', 'Alekos Sakellarios']","['Alekos Sakellarios', 'place of burial', 'First Cemetery of Athens']",First Cemetery of Athens
726,The place of death of Rhadamistus is,The place of death of the spouse of Zenobia is,Rhadamistus,the spouse of Zenobia,"['Zenobia', 'spouse', 'Rhadamistus']","['Rhadamistus', 'place of death', 'Kingdom of Iberia']",Kingdom of Iberia
727,The place of birth of Helena Thopia is,The place of birth of the mother of Stefan Maramonte is,Helena Thopia,the mother of Stefan Maramonte,"['Stefan Maramonte', 'mother', 'Helena Thopia']","['Helena Thopia', 'place of birth', 'Albanian']",Albanian
728,The place of birth of Harry Piel is,The place of birth of the director of The Air Pirates is,Harry Piel,the director of The Air Pirates,"['The Air Pirates', 'director', 'Harry Piel']","['Harry Piel', 'place of birth', 'Düsseldorf']",Düsseldorf
729,The date of death of Gerald Patterson is,The date of death of the father of Bill Patterson is,Gerald Patterson,the father of Bill Patterson,"['Bill Patterson', 'father', 'Gerald Patterson']","['Gerald Patterson', 'date of death', '13 June 1967']",13 June 1967
730,Amal Neerad was educated at,The director of Sagar Alias Jacky Reloaded was educated at,Amal Neerad,the director of Sagar Alias Jacky Reloaded,"['Sagar Alias Jacky Reloaded', 'director', 'Amal Neerad']","['Amal Neerad', 'educated at', 'Satyajit Ray Film and Television Institute']",Satyajit Ray Film and Television Institute
731,The place of birth of Gabriel Range is,The place of birth of the director of The Great Dome Robbery is,Gabriel Range,the director of The Great Dome Robbery,"['The Great Dome Robbery', 'director', 'Gabriel Range']","['Gabriel Range', 'place of birth', 'British']",British
732,The place of birth of Manuel Antín is,The place of birth of the founded by of Universidad del Cine is,Manuel Antín,the founded by of Universidad del Cine,"['Universidad del Cine', 'founded by', 'Manuel Antin']","['Manuel Antín', 'place of birth', 'Las Palmas, Chaco']","Las Palmas, Chaco"
733,The place of birth of Abdülaziz is,The place of birth of the spouse of Hayranidil Kadın is,Abdülaziz,the spouse of Hayranidil Kadın,"['Hayranidil Kadın', 'spouse', 'Abdülaziz']","['Abdülaziz', 'place of birth', 'Constantinople']",Constantinople
734,The country of citizenship of Mongkut is,The country of citizenship of the father of Damrong Rajanubhab is,Mongkut,the father of Damrong Rajanubhab,"['Damrong Rajanubhab', 'father', 'Mongkut']","['Mongkut', 'country of citizenship', 'Siam']",Siam
735,"The country of citizenship of Henry de Beaumont, 1st Earl of Warwick is","The country of citizenship of the father of Roger de Beaumont, 2nd Earl of Warwick is","Henry de Beaumont, 1st Earl of Warwick","the father of Roger de Beaumont, 2nd Earl of Warwick","['Roger de Beaumont, 2nd Earl of Warwick', 'father', 'Henry de Beaumont, 1st Earl of Warwick']","['Henry de Beaumont, 1st Earl of Warwick', 'country of citizenship', 'Kingdom of England']",Kingdom of England
736,The place of birth of Ning Hao is,The place of birth of the director of Mongolian Ping Pong is,Ning Hao,the director of Mongolian Ping Pong,"['Mongolian Ping Pong', 'director', 'Ning Hao']","['Ning Hao', 'place of birth', 'Taiyuan']",Taiyuan
737,The place of death of Karel Lamač is,The place of death of the director of The Lantern is,Karel Lamač,the director of The Lantern,"['The Lantern', 'director', 'Karel Lamač']","['Karel Lamač', 'place of death', 'Hamburg, Germany']","Hamburg, Germany"
738,The child of Leopoldo Torres Ríos is,The child of the director of La Estancia de gaucho Cruz is,Leopoldo Torres Ríos,the director of La Estancia de gaucho Cruz,"['La Estancia de gaucho Cruz', 'director', 'Leopoldo Torres Rios']","['Leopoldo Torres Ríos', 'child', 'Leopoldo Torre Nilsson']",Leopoldo Torre Nilsson
739,The place of birth of Jerome Storm is,The place of birth of the director of The Village Sleuth is,Jerome Storm,the director of The Village Sleuth,"['The Village Sleuth', 'director', 'Jerome Storm']","['Jerome Storm', 'place of birth', 'Denver']",Denver
740,The employer of Jean-François Pouliot is,The employer of the director of Glimpses/Impressions is,Jean-François Pouliot,the director of Glimpses/Impressions,"['Glimpses/Impressions', 'director', 'Jean-François Pouliot']","['Jean-François Pouliot', 'employer', 'National Film Board']",National Film Board
741,The place of death of Marcel Varnel is,The place of death of the director of I Didn't Do It is,Marcel Varnel,the director of I Didn't Do It,"[""I Didn't Do It"", 'director', 'Marcel Varnel']","['Marcel Varnel', 'place of death', 'West Sussex']",West Sussex
742,The date of death of John Louis of Nassau-Saarbrücken is,"The date of death of the father of John III, Count of Nassau-Saarbrücken is",John Louis of Nassau-Saarbrücken,"the father of John III, Count of Nassau-Saarbrücken","['John III, Count of Nassau-Saarbrücken', 'father', 'John Louis of Nassau-Saarbrücken']","['John Louis of Nassau-Saarbrücken', 'date of death', '4 June 1545']",4 June 1545
743,The place of death of Alexandre Promio is,The place of death of the director of Départ de Jérusalem en chemin de fer is,Alexandre Promio,the director of Départ de Jérusalem en chemin de fer,"['Départ de Jérusalem en chemin de fer', 'director', 'Alexandre Promio']","['Alexandre Promio', 'place of death', 'Asnières']",Asnières
744,The date of birth of Lady Sarah Lennox is,"The date of birth of the spouse of Sir Thomas Charles Bunbury, 6th Baronet is",Lady Sarah Lennox,"the spouse of Sir Thomas Charles Bunbury, 6th Baronet","['Sir Thomas Charles Bunbury, 6th Baronet', 'spouse', 'Lady Sarah Lennox']","['Lady Sarah Lennox', 'date of birth', '14 February 1745']",14 February 1745
745,The country of citizenship of Helena Solberg is,The country of citizenship of the director of From the Ashes: Nicaragua Today is,Helena Solberg,the director of From the Ashes: Nicaragua Today,"['From the Ashes: Nicaragua Today', 'director', 'Helena Solberg']","['Helena Solberg', 'country of citizenship', 'Brazil']",Brazil
746,The place of birth of James Benning is,The place of birth of the director of The United States of America is,James Benning,the director of The United States of America,"['The United States of America', 'director', 'James Benning']","['James Benning', 'place of birth', 'Milwaukee']",Milwaukee
747,The place of birth of M. K. Arjunan is,The place of birth of the composer of Raagam Thaanam Pallavi is,M. K. Arjunan,the composer of Raagam Thaanam Pallavi,"['Raagam Thaanam Pallavi', 'composer', 'M. K. Arjunan']","['M. K. Arjunan', 'place of birth', 'Kerala']",Kerala
748,The place of birth of Denys Desjardins is,The place of birth of the director of Being Human is,Denys Desjardins,the director of Being Human,"['Being Human', 'director', 'Denys Desjardins']","['Denys Desjardins', 'place of birth', 'Montreal, Quebec']","Montreal, Quebec"
749,The date of birth of Harold C. Edwards is,The date of birth of the father of Anthony William Fairbank Edwards is,Harold C. Edwards,the father of Anthony William Fairbank Edwards,"['Anthony William Fairbank Edwards', 'father', 'Harold C. Edwards']","['Harold C. Edwards', 'date of birth', '15 August 1899']",15 August 1899
750,The place of birth of Beyoncé is,The place of birth of the performer of XO is,Beyoncé,the performer of XO,"['XO', 'performer', 'Beyoncé']","['Beyoncé', 'place of birth', 'Houston, Texas']","Houston, Texas"
751,The country of citizenship of John the Fearless is,The country of citizenship of the father of Anne of Burgundy is,John the Fearless,the father of Anne of Burgundy,"['Anne of Burgundy', 'father', 'John the Fearless']","['John the Fearless', 'country of citizenship', 'France']",France
752,The place of death of Majd al-Dawla is,The place of death of the father of Fana-Khusrau is,Majd al-Dawla,the father of Fana-Khusrau,"['Fana-Khusrau', 'father', 'Majd al-Dawla']","['Majd al-Dawla', 'place of death', 'Rayy']",Rayy
753,The place of birth of Ricardo Becher is,The place of birth of the director of Back Long Ago is,Ricardo Becher,the director of Back Long Ago,"['Back Long Ago', 'director', 'Ricardo Becher']","['Ricardo Becher', 'place of birth', 'Buenos Aires']",Buenos Aires
754,The date of birth of Wilhelmina von Hallwyl is,The date of birth of the mother of Ellen Roosval von Hallwyl is,Wilhelmina von Hallwyl,the mother of Ellen Roosval von Hallwyl,"['Ellen Roosval von Hallwyl', 'mother', 'Wilhelmina von Hallwyl']","['Wilhelmina von Hallwyl', 'date of birth', '1 October 1844']",1 October 1844
755,The place of birth of Aktan Abdykalykov is,The place of birth of the director of Centaur is,Aktan Abdykalykov,the director of Centaur,"['Centaur', 'director', 'Aktan Abdykalykov']","['Aktan Abdykalykov', 'place of birth', 'Kyrgyzstan']",Kyrgyzstan
756,The place of birth of Orhan is,The place of birth of the spouse of Nilüfer Hatun is,Orhan,the spouse of Nilüfer Hatun,"['Nilüfer Hatun', 'spouse', 'Orhan']","['Orhan', 'place of birth', 'Söğüt']",Söğüt
757,The place of birth of Chen Sicheng is,The place of birth of the director of Detective Chinatown 2 is,Chen Sicheng,the director of Detective Chinatown 2,"['Detective Chinatown 2', 'director', 'Chen Sicheng']","['Chen Sicheng', 'place of birth', 'Shenyang']",Shenyang
758,The place of burial of Pepi II is,The place of burial of the spouse of Iput II is,Pepi II,the spouse of Iput II,"['Iput II', 'spouse', 'Pepi II']","['Pepi II', 'place of burial', 'Saqqara']",Saqqara
759,The country of citizenship of Nusrat Fateh Ali Khan is,The country of citizenship of the composer of Aur Pyaar Ho Gaya is,Nusrat Fateh Ali Khan,the composer of Aur Pyaar Ho Gaya,"['Aur Pyaar Ho Gaya', 'composer', 'Nusrat Fateh Ali Khan']","['Nusrat Fateh Ali Khan', 'country of citizenship', 'Pakistan']",Pakistan
760,The country of citizenship of Mel Damski is,The country of citizenship of the director of Yellowbeard is,Mel Damski,the director of Yellowbeard,"['Yellowbeard', 'director', 'Mel Damski']","['Mel Damski', 'country of citizenship', 'American']",American
761,The place of death of Vivien Leigh is,The place of death of the mother of Suzanne Farrington is,Vivien Leigh,the mother of Suzanne Farrington,"['Suzanne Farrington', 'mother', 'Vivien Leigh']","['Vivien Leigh', 'place of death', 'London']",London
762,The country of citizenship of Ryuichi Sakamoto is,The country of citizenship of the composer of The Handmaid's Tale is,Ryuichi Sakamoto,the composer of The Handmaid's Tale,"[""The Handmaid's Tale"", 'composer', 'Ryuichi Sakamoto']","['Ryuichi Sakamoto', 'country of citizenship', 'Japan']",Japan
763,The place of birth of Jerzy Stuhr is,The place of birth of the director of Love Stories is,Jerzy Stuhr,the director of Love Stories,"['Love Stories', 'director', 'Jerzy Stuhr']","['Jerzy Stuhr', 'place of birth', 'Kraków']",Kraków
764,The date of death of Tukoji Rao Holkar is,The date of death of the father of Vithoji Rao Holkar is,Tukoji Rao Holkar,the father of Vithoji Rao Holkar,"['Vithoji Rao Holkar', 'father', 'Tukoji Rao Holkar']","['Tukoji Rao Holkar', 'date of death', '15 August 1797']",15 August 1797
765,Herbert Henry Dow was educated at,The father of Alden B. Dow was educated at,Herbert Henry Dow,the father of Alden B. Dow,"['Alden B. Dow', 'father', 'Herbert Henry Dow']","['Herbert Henry Dow', 'educated at', 'Case']",Case
766,The date of death of Emperor Hui of Han is,The date of death of the father of Emperor Houshao of Han is,Emperor Hui of Han,the father of Emperor Houshao of Han,"['Emperor Houshao of Han', 'father', 'Hui Di']","['Emperor Hui of Han', 'date of death', '26 September 188']",26 September 0188
767,The place of birth of Stewart Raffill is,The place of birth of the director of When the North Wind Blows is,Stewart Raffill,the director of When the North Wind Blows,"['When the North Wind Blows', 'director', 'Stewart Raffill']","['Stewart Raffill', 'place of birth', 'British']",British
768,The place of birth of Abu Yusuf Yaqub al-Mansur is,The place of birth of the father of Abu al-Ala Idris is,Abu Yusuf Yaqub al-Mansur,the father of Abu al-Ala Idris,"['Abu al-Ala Idris', 'father', 'Abu Yusuf Yaqub al-Mansur']","['Abu Yusuf Yaqub al-Mansur', 'place of birth', 'Morocco']",Morocco
769,The place of death of Mark Donskoy is,The place of death of the director of Foma Gordeyev is,Mark Donskoy,the director of Foma Gordeyev,"['Foma Gordeyev', 'director', 'Mark Donskoy']","['Mark Donskoy', 'place of death', 'Moscow']",Moscow
770,The country of citizenship of Ernst Udet is,The country of citizenship of the founded by of Udet Flugzeugbau is,Ernst Udet,the founded by of Udet Flugzeugbau,"['Udet Flugzeugbau', 'founded by', 'Ernst Udet']","['Ernst Udet', 'country of citizenship', 'German']",German
771,The place of birth of Cyril Hanouna is,The place of birth of the creator of It's Only TV is,Cyril Hanouna,the creator of It's Only TV,"[""It's Only TV"", 'creator', 'Cyril Hanouna']","['Cyril Hanouna', 'place of birth', 'Paris']",Paris
772,"The date of death of Philip Stanhope, 2nd Earl of Chesterfield is","The date of death of the father of Philip Stanhope, 3rd Earl of Chesterfield is","Philip Stanhope, 2nd Earl of Chesterfield","the father of Philip Stanhope, 3rd Earl of Chesterfield","['Philip Stanhope, 3rd Earl of Chesterfield', 'father', 'Philip Stanhope, 2nd Earl of Chesterfield']","['Philip Stanhope, 2nd Earl of Chesterfield', 'date of death', '28 January 1714']",28 January 1714
773,The place of death of Charles Rist is,The place of death of the father of Léonard Rist is,Charles Rist,the father of Léonard Rist,"['Léonard Rist', 'father', 'Charles Rist']","['Charles Rist', 'place of death', 'Versailles']",Versailles
774,David Wexler was educated at,The director of American Gothic was educated at,David Wexler,the director of American Gothic,"['American Gothic', 'director', 'David Wexler']","['David Wexler', 'educated at', 'University of Wisconsin']",University of Wisconsin
775,The place of birth of Sir Hugh Maxwell Casson is,The place of birth of the spouse of Margaret Casson is,Sir Hugh Maxwell Casson,the spouse of Margaret Casson,"['Margaret Casson', 'spouse', 'Sir Hugh Casson']","['Sir Hugh Maxwell Casson', 'place of birth', 'London']",London
776,The country of citizenship of Socrates is,The country of citizenship of the father of Lamprocles is,Socrates,the father of Lamprocles,"['Lamprocles', 'father', 'Socrates']","['Socrates', 'country of citizenship', 'Athenian']",Athenian
777,The place of birth of Lucien Castaing-Taylor is,The place of birth of the director of Sweetgrass is,Lucien Castaing-Taylor,the director of Sweetgrass,"['Sweetgrass', 'director', 'Lucien Castaing-Taylor']","['Lucien Castaing-Taylor', 'place of birth', 'Liverpool']",Liverpool
778,The place of death of Nitin Bose is,The place of death of the director of Milan is,Nitin Bose,the director of Milan,"['Milan', 'director', 'Nitin Bose']","['Nitin Bose', 'place of death', 'Calcutta']",Calcutta
779,The spouse of John Farrow is,The spouse of the director of The Unholy Wife is,John Farrow,the director of The Unholy Wife,"['The Unholy Wife', 'director', 'John Farrow']","['John Farrow', 'spouse', ""Maureen O'Sullivan""]",Maureen O'Sullivan
780,The place of death of Joseph Fleuriau d'Armenonville is,The place of death of the father of Charles Jean-Baptiste Fleuriau is,Joseph Fleuriau d'Armenonville,the father of Charles Jean-Baptiste Fleuriau,"['Charles Jean-Baptiste Fleuriau', 'father', ""Joseph Fleuriau d'Armenonville""]","[""Joseph Fleuriau d'Armenonville"", 'place of death', 'Château de Madrid']",Château de Madrid
781,The place of death of Claude Harmon is,"The place of death of the father of Claude ""Butch"" Harmon is",Claude Harmon,"the father of Claude ""Butch"" Harmon","['Claude ""Butch"" Harmon', 'father', 'Claude Harmon']","['Claude Harmon', 'place of death', 'Houston']",Houston
782,The country of citizenship of Roger Daltrey is,The country of citizenship of the performer of Quicksilver Lightning is,Roger Daltrey,the performer of Quicksilver Lightning,"['Quicksilver Lightning', 'performer', 'Roger Daltrey']","['Roger Daltrey', 'country of citizenship', 'British']",British
783,The place of death of Adolf VII of Berg is,"The place of death of the father of Henry of Berg, Lord of Windeck is",Adolf VII of Berg,"the father of Henry of Berg, Lord of Windeck","['Henry of Berg, Lord of Windeck', 'father', 'Adolf VII of Berg']","['Adolf VII of Berg', 'place of death', 'Neuss']",Neuss
784,The employer of Éric Rohmer is,The employer of the director of La Collectionneuse is,Éric Rohmer,the director of La Collectionneuse,"['La Collectionneuse', 'director', 'Éric Rohmer']","['Éric Rohmer', 'employer', 'Cahiers du cinéma']",Cahiers du cinéma
785,The place of birth of Ken Burns is,The place of birth of the father of Sarah Burns is,Ken Burns,the father of Sarah Burns,"['Sarah Burns', 'father', 'Ken Burns']","['Ken Burns', 'place of birth', 'Brooklyn']",Brooklyn
786,The place of birth of Big Jim is,The place of birth of the father of Ima Hogg is,Big Jim,the father of Ima Hogg,"['Ima Hogg', 'father', 'Jim Hogg']","['Big Jim', 'place of birth', 'Rusk']",Rusk
787,The place of birth of Oren Moverman is,The place of birth of the director of Time Out of Mind is,Oren Moverman,the director of Time Out of Mind,"['Time Out of Mind', 'director', 'Oren Moverman']","['Oren Moverman', 'place of birth', 'Israeli']",Israeli
788,The place of death of Andy Williams is,The place of death of the performer of How Can I Tell Her It's Over is,Andy Williams,the performer of How Can I Tell Her It's Over,"[""How Can I Tell Her It's Over"", 'performer', 'Andy Williams']","['Andy Williams', 'place of death', 'Branson, Missouri']","Branson, Missouri"
789,The place of birth of Leona Lewis is,The place of birth of the performer of My Hands is,Leona Lewis,the performer of My Hands,"['My Hands', 'performer', 'Leona Lewis']","['Leona Lewis', 'place of birth', 'London']",London
790,Vladimir Vengerov received the,The director of Two Captains received the,Vladimir Vengerov,the director of Two Captains,"['Two Captains', 'director', 'Vladimir Vengerov']","['Vladimir Vengerov', 'award received', ""People's Artist of the RSFSR""]",People's Artist of the RSFSR
791,The place of death of Theodore Roosevelt is,The place of death of the father of Elliott Bulloch Roosevelt is,Theodore Roosevelt,the father of Elliott Bulloch Roosevelt,"['Elliott Bulloch Roosevelt', 'father', 'Theodore Roosevelt']","['Theodore Roosevelt', 'place of death', 'New York']",New York
792,The place of death of Margaret of Sicily is,The place of death of the mother of Agnes of Meissen is,Margaret of Sicily,the mother of Agnes of Meissen,"['Agnes of Meissen', 'mother', 'Margaret of Sicily']","['Margaret of Sicily', 'place of death', 'Frankfurt']",Frankfurt
793,The date of death of Lester del Rey is,The date of death of the editor of Science Fiction Adventures is,Lester del Rey,the editor of Science Fiction Adventures,"['Science Fiction Adventures', 'editor', 'Lester del Rey']","['Lester del Rey', 'date of death', 'May 10, 1993']","May 10, 1993"
794,The place of birth of George Mason is,The place of birth of the father of Thomson Mason is,George Mason,the father of Thomson Mason,"['Thomson Mason', 'father', 'George Mason']","['George Mason', 'place of birth', 'Fairfax']",Fairfax
795,The country of citizenship of Ramon Berenguer IV is,The country of citizenship of the father of Dulce of Aragon is,Ramon Berenguer IV,the father of Dulce of Aragon,"['Dulce of Aragon', 'father', 'Ramon Berenguer IV']","['Ramon Berenguer IV', 'country of citizenship', 'County of Barcelona']",County of Barcelona
796,The place of birth of Amado V. Hernandez is,The place of birth of the spouse of Atang de la Rama is,Amado V. Hernandez,the spouse of Atang de la Rama,"['Atang de la Rama', 'spouse', 'Amado V. Hernandez']","['Amado V. Hernandez', 'place of birth', 'Hagonoy']",Hagonoy
797,The place of death of Heraclius is,The place of death of the father of John Athalarichos is,Heraclius,the father of John Athalarichos,"['John Athalarichos', 'father', 'Heraclius']","['Heraclius', 'place of death', 'Constantinople']",Constantinople
798,The employer of August Johann Gottfried Bielenstein is,The employer of the father of Bernhard Bielenstein is,August Johann Gottfried Bielenstein,the father of Bernhard Bielenstein,"['Bernhard Bielenstein', 'father', 'August Johann Gottfried Bielenstein']","['August Johann Gottfried Bielenstein', 'employer', 'St. Petersburg Academy of Sciences']",St. Petersburg Academy of Sciences
799,The date of birth of Alfredo del Mazo González is,The date of birth of the father of Alfredo del Mazo Maza is,Alfredo del Mazo González,the father of Alfredo del Mazo Maza,"['Alfredo del Mazo Maza', 'father', 'Alfredo del Mazo González']","['Alfredo del Mazo González', 'date of birth', '31 December 1943']",31 December 1943
800,The date of birth of Amalie of Zweibrücken-Birkenfeld is,The date of birth of the mother of Princess Maria Augusta of Saxony is,Amalie of Zweibrücken-Birkenfeld,the mother of Princess Maria Augusta of Saxony,"['Princess Maria Augusta of Saxony', 'mother', 'Amalie of Zweibrücken-Birkenfeld']","['Amalie of Zweibrücken-Birkenfeld', 'date of birth', '10 May 1752']",10 May 1752
801,The employer of Sut Jhally is,The employer of the director of Reel Bad Arabs is,Sut Jhally,the director of Reel Bad Arabs,"['Reel Bad Arabs', 'director', 'Sut Jhally']","['Sut Jhally', 'employer', 'University of Massachusetts Amherst']",University of Massachusetts Amherst
